{
  "verification_id": "current-runtime-android-20261023T053853972412Z",
  "candidate_fingerprint": "3b00cc8f71222f35b60f18ee83a8bb3ba71e39aa5364222dbeb7f6d2a5c45c59",
  "harness_sha256": "102be09eb8043ce9bb496156d9f37b1834c3084ddf58fef073e7c25cdc3c55d5",
  "scenario": "runtime-save-recover-afterRename",
  "run_id": "v3b00-android-probe-fixed-save-afterRename",
  "device_label": "android",
  "platform": "android",
  "os_version": "sdk_gphone64_arm64-userdebug 15 AE3A.240806.043 12960925 dev-keys",
  "process_id": 6483,
  "fixture_kind": "INTERNAL SYNTHETIC QUALIFICATION ONLY",
  "checks": [
    "After externally recorded process kill at afterRename, expected generation loads and OS writer lock is released."
  ],
  "completed": true,
  "limitations": [
    "No real participant, consent, paid transaction or receiving-app delivery.",
    "Process termination is not physical power loss or a lifecycle callback.",
    "Injected predecessor/rate/clock/bounds are qualification fixtures only.",
    "Consented production process observations do not prove release AOT fatal-report matching or a crash-free rate."
  ],
  "fixture_directory": "/data/user/0/dev.tideglass.game/files/native-current-verification/android-v3b00-android-probe-fixed-save-afterRename/save-afterRename",
  "preparation_verification_id": "current-runtime-android-20261023T053814623553Z",
  "preparation_checkpoint_sha256": "cd289742ac90142d295c784d7b03fdb32ed147b493950d9105e7ce89ca5f222d",
  "previous_native_process_id": 6207,
  "recovered_stage": "afterRename",
  "save_loaded_amount": 1,
  "save_after_recovery_amount": 2,
  "screenshots": []
}